[
  {
    "test_sequence": 1,
    "step": 1,
    "command": "echo \"Step 1 executed\"",
    "exit_code": 0,
    "output": "Step 1 executed",
    "timestamp": "2026-02-28T10:00:00.123456+00:00",
    "result_verification_pass": true,
    "output_verification_pass": true
  },
  {
    "test_sequence": 1,
    "step": 2,
    "command": "echo \"Step 2 executed\"",
    "exit_code": 0,
    "output": "Step 2 executed",
    "timestamp": "2026-02-28T10:00:00.456789+00:00",
    "result_verification_pass": true,
    "output_verification_pass": true
  }
]
