[
  {
    "test_sequence": 1,
    "step": 1,
    "command": "echo \"42\"",
    "exit_code": 0,
    "output": "42",
    "timestamp": "2026-03-01T10:00:00.123456+00:00",
    "result_verification_pass": true,
    "output_verification_pass": true
  },
  {
    "test_sequence": 1,
    "step": 2,
    "command": "echo \"3.14159\"",
    "exit_code": 0,
    "output": "3.14159",
    "timestamp": "2026-03-01T10:00:00.234567+00:00",
    "result_verification_pass": true,
    "output_verification_pass": true
  },
  {
    "test_sequence": 1,
    "step": 3,
    "command": "echo \"-100\"",
    "exit_code": 0,
    "output": "-100",
    "timestamp": "2026-03-01T10:00:00.345678+00:00",
    "result_verification_pass": true,
    "output_verification_pass": true
  }
]
