[
  {
    "test_sequence": 1,
    "step": 1,
    "command": "echo \"Hello World\"",
    "exit_code": 0,
    "output": "Hello World",
    "timestamp": "2026-02-02T13:24:59.550547+04:00",
    "result_verification_pass": true,
    "output_verification_pass": true
  },
  {
    "test_sequence": 1,
    "step": 2,
    "command": "true",
    "exit_code": 0,
    "output": "",
    "timestamp": "2026-02-02T13:24:59.567435+04:00",
    "result_verification_pass": true,
    "output_verification_pass": true
  },
  {
    "test_sequence": 1,
    "step": 3,
    "command": "false",
    "exit_code": 1,
    "output": "",
    "timestamp": "2026-02-02T13:24:59.574455+04:00",
    "result_verification_pass": true,
    "output_verification_pass": true
  },
  {
    "test_sequence": 2,
    "step": 1,
    "command": "echo \"Status: SUCCESS\"",
    "exit_code": 0,
    "output": "Status: SUCCESS",
    "timestamp": "2026-02-02T13:24:59.579597+04:00",
    "result_verification_pass": true,
    "output_verification_pass": true
  },
  {
    "test_sequence": 2,
    "step": 2,
    "command": "echo \"Operation completed\"",
    "exit_code": 0,
    "output": "Operation completed",
    "timestamp": "2026-02-02T13:24:59.587251+04:00",
    "result_verification_pass": true,
    "output_verification_pass": true
  },
  {
    "test_sequence": 2,
    "step": 3,
    "command": "echo -e \"Line 1\\nLine 2\\nLine 3\"",
    "exit_code": 0,
    "output": "Line 1\nLine 2\nLine 3",
    "timestamp": "2026-02-02T13:24:59.595312+04:00",
    "result_verification_pass": true,
    "output_verification_pass": true
  },
  {
    "test_sequence": 3,
    "step": 1,
    "command": "/bin/sh -c \"exit 0\"",
    "exit_code": 0,
    "output": "",
    "timestamp": "2026-02-02T13:24:59.607075+04:00",
    "result_verification_pass": true,
    "output_verification_pass": true
  },
  {
    "test_sequence": 3,
    "step": 2,
    "command": "/bin/sh -c \"exit 1\"",
    "exit_code": 1,
    "output": "",
    "timestamp": "2026-02-02T13:24:59.613462+04:00",
    "result_verification_pass": true,
    "output_verification_pass": true
  },
  {
    "test_sequence": 3,
    "step": 3,
    "command": "/bin/sh -c \"exit 2\"",
    "exit_code": 2,
    "output": "",
    "timestamp": "2026-02-02T13:24:59.619776+04:00",
    "result_verification_pass": true,
    "output_verification_pass": true
  },
  {
    "test_sequence": 4,
    "step": 1,
    "command": "echo \"Basic test\"",
    "exit_code": 0,
    "output": "Basic test",
    "timestamp": "2026-02-02T13:24:59.624314+04:00",
    "result_verification_pass": true,
    "output_verification_pass": true
  },
  {
    "test_sequence": 4,
    "step": 2,
    "command": "echo \"Status: SUCCESS\"",
    "exit_code": 0,
    "output": "Status: SUCCESS",
    "timestamp": "2026-02-02T13:24:59.631640+04:00",
    "result_verification_pass": true,
    "output_verification_pass": true
  },
  {
    "test_sequence": 4,
    "step": 3,
    "command": "/bin/sh -c \"exit 10\"",
    "exit_code": 10,
    "output": "",
    "timestamp": "2026-02-02T13:24:59.642298+04:00",
    "result_verification_pass": true,
    "output_verification_pass": true
  },
  {
    "test_sequence": 4,
    "step": 4,
    "command": "echo \"Count: 42\"",
    "exit_code": 0,
    "output": "Count: 42",
    "timestamp": "2026-02-02T13:24:59.645647+04:00",
    "result_verification_pass": true,
    "output_verification_pass": true
  },
  {
    "test_sequence": 4,
    "step": 5,
    "command": "echo \"Complete\"",
    "exit_code": 0,
    "output": "Complete",
    "timestamp": "2026-02-02T13:24:59.652739+04:00",
    "result_verification_pass": true,
    "output_verification_pass": true
  }
]
