[
  {
    "test_sequence": 1,
    "step": 1,
    "command": "echo \"Seq1 Step1\"",
    "exit_code": 0,
    "output": "Seq1 Step1",
    "timestamp": "2026-03-01T10:00:00.123456+00:00",
    "result_verification_pass": true,
    "output_verification_pass": true
  },
  {
    "test_sequence": 1,
    "step": 2,
    "command": "echo \"Seq1 Step2\"",
    "exit_code": 0,
    "output": "Seq1 Step2",
    "timestamp": "2026-03-01T10:00:00.234567+00:00",
    "result_verification_pass": true,
    "output_verification_pass": true
  },
  {
    "test_sequence": 2,
    "step": 1,
    "command": "echo \"Seq2 Step1\"",
    "exit_code": 0,
    "output": "Seq2 Step1",
    "timestamp": "2026-03-01T10:00:00.345678+00:00",
    "result_verification_pass": true,
    "output_verification_pass": true
  },
  {
    "test_sequence": 2,
    "step": 2,
    "command": "echo \"Seq2 Step2\"",
    "exit_code": 0,
    "output": "Seq2 Step2",
    "timestamp": "2026-03-01T10:00:00.456789+00:00",
    "result_verification_pass": true,
    "output_verification_pass": true
  }
]
