[
  {
    "test_sequence": 1,
    "step": 1,
    "command": "printf \"Line 1\\nLine 2\\nLine 3\"",
    "exit_code": 0,
    "output": "Line 1\nLine 2\nLine 3",
    "timestamp": "2026-03-01T10:00:00.123456+00:00",
    "result_verification_pass": true,
    "output_verification_pass": true
  },
  {
    "test_sequence": 1,
    "step": 2,
    "command": "echo \"This is a longer output message with multiple words\"",
    "exit_code": 0,
    "output": "This is a longer output message with multiple words",
    "timestamp": "2026-03-01T10:00:00.234567+00:00",
    "result_verification_pass": true,
    "output_verification_pass": true
  }
]
